{
  "definitions": {},
  "$schema": "http://json-schema.org/draft-07/schema#",
  "$id": "http://example.com/root.json",
  "type": "array",
  "title": "The Root Schema",
  "items": {
    "$id": "#/items",
    "type": "object",
    "title": "The Items Schema",
    "required": ["githubUrl"],
    "properties": {
      "githubUrl": {
        "$id": "#/items/properties/githubUrl",
        "type": "string",
        "title": "The Githuburl Schema",
        "default": "",
        "examples": ["https://github.com/webstyle-directory/website"],
        "pattern": "^(.*)$"
      },
      "uiComponents": {
        "$id": "#/items/properties/uiComponents",
        "type": "boolean",
        "title": "The uiComponents Schema",
        "default": false,
        "examples": [true]
      },
      "templates": {
        "$id": "#/items/properties/templates",
        "type": "boolean",
        "title": "The templates Schema",
        "default": false,
        "examples": [true]
      },
      "scss": {
        "$id": "#/items/properties/scss",
        "type": "boolean",
        "title": "The scss Schema",
        "default": false,
        "examples": [true]
      },
      "less": {
        "$id": "#/items/properties/less",
        "type": "boolean",
        "title": "The less Schema",
        "default": false,
        "examples": [true]
      },
      "vanilacss": {
        "$id": "#/items/properties/vanilacss",
        "type": "boolean",
        "title": "The vanilacss Schema",
        "default": false,
        "examples": [true]
      },
      "react": {
        "$id": "#/items/properties/react",
        "type": "boolean",
        "title": "The react Schema",
        "default": false,
        "examples": [true]
      },
      "angular": {
        "$id": "#/items/properties/angular",
        "type": "boolean",
        "title": "The angular Schema",
        "default": false,
        "examples": [true]
      },
      "vue": {
        "$id": "#/items/properties/vue",
        "type": "boolean",
        "title": "The vue Schema",
        "default": false,
        "examples": [true]
      },
      "examples": {
        "$id": "#/items/properties/examples",
        "type": "array",
        "title": "The Examples Schema",
        "default": null,
        "items": {
          "$id": "#/items/properties/examples/items",
          "type": "string",
          "title": "The Items Schema",
          "default": "",
          "examples": ["https://snack.expo.io/SkRP2Ehrb"],
          "pattern": "^(.*)$"
        }
      },
      "npmPkg": {
        "$id": "#/items/properties/npmPkg",
        "type": "string",
        "title": "The Npmpkg Schema",
        "default": "",
        "examples": ["@expo/ex-navigation"],
        "pattern": "^(.*)$"
      },
      "unmaintained": {
        "$id": "#/items/properties/unmaintained",
        "type": "boolean",
        "title": "The Unmaintained Schema",
        "default": false,
        "examples": [true]
      },
      "images": {
        "$id": "#/items/properties/images",
        "type": "array",
        "title": "The Images Schema",
        "default": [null],
        "items": {
          "$id": "#/items/properties/images/items",
          "type": "string",
          "title": "The Image Schema",
          "default": "",
          "examples": ["https://reactnative.dev/img/homepage/phones.png"],
          "pattern": "^(http(s?):)([/|.|\\w|\\s|-])*\\.(?:jpg|gif|png)$"
        }
      },
      "nameOverride": {
        "$id": "#/items/properties/nameOverride",
        "type": "string",
        "title": "Optional property to override the name provided by npm and GitHub",
        "default": "",
        "examples": ["react-navigation"],
        "pattern": "^(.*)$"
      },
      "dev": {
        "$id": "#/items/properties/dev",
        "type": "boolean",
        "title": "The Development Tool Schema",
        "default": false,
        "examples": [true]
      }
    }
  }
}
