[
  {
    "githubUrl": "https://github.com/twbs/bootstrap",
    "uiComponents": true,
    "templates": true,
    "scss": true,
    "less": false,
    "vanilacss": false
  },
  {
    "githubUrl": "https://github.com/pure-css/pure",
    "uiComponents": true,
    "templates": true,
    "scss": false,
    "less": false,
    "vanilacss": true
  },
  {
    "githubUrl": "https://github.com/vmware/clarity",
    "uiComponents": true,
    "templates": true,
    "scss": false,
    "less": false,
    "vanilacss": true,
    "angular": true
  },
  {
    "githubUrl": "https://github.com/mui-org/material-ui",
    "uiComponents": true,
    "templates": true,
    "scss": false,
    "less": false,
    "vanilacss": false,
    "react": true
  },
  {
    "githubUrl": "https://github.com/vmware/clarity",
    "npmPkg": "@clr/angular",
    "uiComponents": true,
    "templates": true,
    "scss": false,
    "less": false,
    "vanilacss": true,
    "angular": true
  },
  {
    "githubUrl": "https://github.com/uber/baseweb",
    "uiComponents": true,
    "templates": true,
    "scss": false,
    "less": false,
    "vanilacss": false,
    "react": true
  }
]